{"agent":"writer","buildProfile":"default","mediaType":"application/vnd.agentsuite.composition.v1+json","platform":{"architecture":"amd64","os":"linux"},"schemaVersion":"1.0.0-draft","toolProviders":[{"executionMode":"shared-sandbox","id":"lookup","manifestDigest":"sha256:6d3c4eac2b9c2ca9a0e22f99c8cdfcf904c6f68df4d56afca0397c81d267c862","variantDigest":"sha256:8fa188685a9216bf2accee8025a50c88e2027e677f41c156dc87d8877fc507a6","version":"1.0.0"}]}